{
  "$schema": "http://json-schema.org/draft-07/schema",
  "$id": "https://com.offlinebrain/schema/hexrl/genrules.schema.json",
  "title": "Constraint",
  "description": "A constraint on a transformation.",
  "type": "object",
  "properties": {
    "size": {
      "type": "object",
      "$ref": "room_size.schema.json"
    },
    "generations": {
      "type": "integer",
      "minimum": 1
    },
    "initialStates": {
      "type": "object",
      "propertyNames": {
        "$ref": "cell.schema.json"
      },
      "patternProperties": {
        "": {
          "type": "number",
          "minimum": 0,
          "maximum": 1
        }
      },
      "additionalProperties": false,
      "minProperties": 1
    },
    "rules": {
      "type": "array",
      "items": {
        "type": "object",
        "properties": {
          "states": {
            "type": "array",
            "items": {
              "$ref": "cell.schema.json"
            },
            "minItems": 1
          },
          "transformations": {
            "type": "array",
            "items": {
              "$ref": "transformation_rule.schema.json"
            },
            "minItems": 1
          }
        },
        "additionalProperties": false,
        "required": [
          "states",
          "transformations"
        ]
      },
      "minItems": 1
    },
    "goal": {
      "type": "object",
      "properties": {
        "match": {
          "$ref": "match.schema.json"
        },
        "constraints": {
          "type": "array",
          "items": {
            "$ref": "constraint.schema.json"
          },
          "minItems": 1
        }
      },
      "required": [
        "constraints",
        "match"
      ],
      "additionalProperties": false
    }
  },
  "additionalProperties": false,
  "required": [
    "generations",
    "initialStates",
    "rules",
    "size",
    "goal"
  ]
}
