{
  "size": {
    "minWidth": 20,
    "minHeight": 20,
    "maxWidth": 25,
    "maxHeight": 25
  },
  "generations": 5,
  "initialStates": {
    "FLOOR": 0.5,
    "WALL": 0.5
  },
  "rules": [
    {
      "states": [
        "LIGHT_CRYSTAL"
      ],
      "transformations": [
        {
          "match": "ALL",
          "result": "FLOOR",
          "probability": 1,
          "constraints": [
            {
              "value": 1,
              "cell": "LIGHT_CRYSTAL",
              "condition": {
                "#operator": ">="
              }
            }
          ]
        }
      ]
    },
    {
      "states": [
        "FLOOR"
      ],
      "transformations": [
        {
          "match": "ALL",
          "constraints": [
            {
              "cell": "WALL",
              "value": 4,
              "condition": {
                "#operator": ">="
              }
            },
            {
              "cell": "WALL",
              "value": 5,
              "condition": {
                "#operator": "!="
              }
            }
          ],
          "result": "WALL"
        }
      ]
    },
    {
      "states": [
        "WALL"
      ],
      "transformations": [
        {
          "match": "ALL",
          "constraints": [
            {
              "cell": "FLOOR",
              "value": 4,
              "condition": {
                "#operator": ">="
              }
            },
            {
              "cell": "FLOOR",
              "value": 6,
              "condition": {
                "#operator": "<"
              }
            }
          ],
          "result": "FLOOR",
          "probability": 1
        }
      ]
    }
  ],
  "goal": {
    "match": "ALL",
    "constraints": [
      {
        "cell": "FLOOR",
        "value": 10,
        "condition": {
          "#operator": ">="
        }
      }
    ]
  }
}
